{
  "manifest_version": "1.0.0",
  "project_code": "SIH260042",
  "language_code": "unr",
  "generated_date": "2026-09-04",
  "total_recordings": 77,
  "summary": {
    "accepted_count": 72,
    "unreviewed_count": 0,
    "rejected_count": 5,
    "total_duration_minutes": 1.27
  },
  "recordings": [
    {
      "recording_id": "REC_MOCK_CHILD_GIRL_SPK_C01_BG_REP01",
      "file_path": "data/processed/mock_field_session/REC_MOCK_CHILD_GIRL_SPK_C01_BG_REP01.wav",
      "speaker_id": "SPK_C01",
      "speaker_group": "CHILD_GIRL",
      "class_index": 0,
      "label_id": "_background_",
      "domain": "FLN_GRADE1_NUMERACY",
      "prompt_type": "BACKGROUND_NOISE",
      "prompt_text": "मौन / एटाः",
      "transcribed_text": "मौन / एटाः",
      "phonetic_transcription": "silence",
      "dialect_region": "Naguri (Khunti District)",
      "repetition": 1,
      "session_num": 1,
      "audio_metrics": {
        "sample_rate_hz": 16000,
        "channels": 1,
        "bit_depth": 16,
        "duration_ms": 1000.0,
        "rms_dbfs": -48.96,
        "peak_dbfs": -38.44,
        "snr_db": 6.71,
        "clipping_detected": false,
        "dc_offset": 2e-05
      },
      "review": {
        "status": "ACCEPTED",
        "reviewer_id": "REV_MUNDARI_01",
        "pronunciation_quality": "EXCELLENT_NATIVE",
        "timestamp_iso": "2026-09-04T10:12:30.782773+00:00",
        "notes": "MOCK_FIXTURE_FOR_PIPELINE_VALIDATION_ONLY"
      }
    },
    {
      "recording_id": "REC_MOCK_CHILD_GIRL_SPK_C01_BG_REP02",
      "file_path": "data/processed/mock_field_session/REC_MOCK_CHILD_GIRL_SPK_C01_BG_REP02.wav",
      "speaker_id": "SPK_C01",
      "speaker_group": "CHILD_GIRL",
      "class_index": 0,
      "label_id": "_background_",
      "domain": "FLN_GRADE1_NUMERACY",
      "prompt_type": "BACKGROUND_NOISE",
      "prompt_text": "मौन / एटाः",
      "transcribed_text": "मौन / एटाः",
      "phonetic_transcription": "silence",
      "dialect_region": "Naguri (Khunti District)",
      "repetition": 2,
      "session_num": 1,
      "audio_metrics": {
        "sample_rate_hz": 16000,
        "channels": 1,
        "bit_depth": 16,
        "duration_ms": 1000.0,
        "rms_dbfs": -48.89,
        "peak_dbfs": -38.71,
        "snr_db": 6.83,
        "clipping_detected": false,
        "dc_offset": -0.0
      },
      "review": {
        "status": "ACCEPTED",
        "reviewer_id": "REV_MUNDARI_01",
        "pronunciation_quality": "EXCELLENT_NATIVE",
        "timestamp_iso": "2026-09-04T10:12:30.802631+00:00",
        "notes": "MOCK_FIXTURE_FOR_PIPELINE_VALIDATION_ONLY"
      }
    },
    {
      "recording_id": "REC_MOCK_CHILD_GIRL_SPK_C01_NUM01_REP01",
      "file_path": "data/processed/mock_field_session/REC_MOCK_CHILD_GIRL_SPK_C01_NUM01_REP01.wav",
      "speaker_id": "SPK_C01",
      "speaker_group": "CHILD_GIRL",
      "class_index": 1,
      "label_id": "num_01",
      "domain": "FLN_GRADE1_NUMERACY",
      "prompt_type": "ISOLATED_WORD",
      "prompt_text": "मिअद",
      "transcribed_text": "मिअद",
      "phonetic_transcription": "miad",
      "dialect_region": "Naguri (Khunti District)",
      "repetition": 1,
      "session_num": 1,
      "audio_metrics": {
        "sample_rate_hz": 16000,
        "channels": 1,
        "bit_depth": 16,
        "duration_ms": 1000.0,
        "rms_dbfs": -17.71,
        "peak_dbfs": -12.91,
        "snr_db": 38.37,
        "clipping_detected": false,
        "dc_offset": -1e-05
      },
      "review": {
        "status": "ACCEPTED",
        "reviewer_id": "REV_MUNDARI_01",
        "pronunciation_quality": "EXCELLENT_NATIVE",
        "timestamp_iso": "2026-09-04T10:12:30.823507+00:00",
        "notes": "MOCK_FIXTURE_FOR_PIPELINE_VALIDATION_ONLY"
      }
    },
    {
      "recording_id": "REC_MOCK_CHILD_GIRL_SPK_C01_NUM01_REP02",
      "file_path": "data/processed/mock_field_session/REC_MOCK_CHILD_GIRL_SPK_C01_NUM01_REP02.wav",
      "speaker_id": "SPK_C01",
      "speaker_group": "CHILD_GIRL",
      "class_index": 1,
      "label_id": "num_01",
      "domain": "FLN_GRADE1_NUMERACY",
      "prompt_type": "ISOLATED_WORD",
      "prompt_text": "मिअद",
      "transcribed_text": "मिअद",
      "phonetic_transcription": "miad",
      "dialect_region": "Naguri (Khunti District)",
      "repetition": 2,
      "session_num": 1,
      "audio_metrics": {
        "sample_rate_hz": 16000,
        "channels": 1,
        "bit_depth": 16,
        "duration_ms": 1000.0,
        "rms_dbfs": -17.71,
        "peak_dbfs": -12.9,
        "snr_db": 38.27,
        "clipping_detected": false,
        "dc_offset": 2e-05
      },
      "review": {
        "status": "ACCEPTED",
        "reviewer_id": "REV_MUNDARI_01",
        "pronunciation_quality": "EXCELLENT_NATIVE",
        "timestamp_iso": "2026-09-04T10:12:30.832231+00:00",
        "notes": "MOCK_FIXTURE_FOR_PIPELINE_VALIDATION_ONLY"
      }
    },
    {
      "recording_id": "REC_MOCK_CHILD_GIRL_SPK_C01_NUM02_REP01",
      "file_path": "data/processed/mock_field_session/REC_MOCK_CHILD_GIRL_SPK_C01_NUM02_REP01.wav",
      "speaker_id": "SPK_C01",
      "speaker_group": "CHILD_GIRL",
      "class_index": 2,
      "label_id": "num_02",
      "domain": "FLN_GRADE1_NUMERACY",
      "prompt_type": "ISOLATED_WORD",
      "prompt_text": "बारिया",
      "transcribed_text": "बारिया",
      "phonetic_transcription": "baria",
      "dialect_region": "Naguri (Khunti District)",
      "repetition": 1,
      "session_num": 1,
      "audio_metrics": {
        "sample_rate_hz": 16000,
        "channels": 1,
        "bit_depth": 16,
        "duration_ms": 1000.0,
        "rms_dbfs": -17.71,
        "peak_dbfs": -12.95,
        "snr_db": 38.17,
        "clipping_detected": false,
        "dc_offset": 1e-05
      },
      "review": {
        "status": "ACCEPTED",
        "reviewer_id": "REV_MUNDARI_01",
        "pronunciation_quality": "EXCELLENT_NATIVE",
        "timestamp_iso": "2026-09-04T10:12:30.849798+00:00",
        "notes": "MOCK_FIXTURE_FOR_PIPELINE_VALIDATION_ONLY"
      }
    },
    {
      "recording_id": "REC_MOCK_CHILD_GIRL_SPK_C01_NUM02_REP02",
      "file_path": "data/processed/mock_field_session/REC_MOCK_CHILD_GIRL_SPK_C01_NUM02_REP02.wav",
      "speaker_id": "SPK_C01",
      "speaker_group": "CHILD_GIRL",
      "class_index": 2,
      "label_id": "num_02",
      "domain": "FLN_GRADE1_NUMERACY",
      "prompt_type": "ISOLATED_WORD",
      "prompt_text": "बारिया",
      "transcribed_text": "बारिया",
      "phonetic_transcription": "baria",
      "dialect_region": "Naguri (Khunti District)",
      "repetition": 2,
      "session_num": 1,
      "audio_metrics": {
        "sample_rate_hz": 16000,
        "channels": 1,
        "bit_depth": 16,
        "duration_ms": 1000.0,
        "rms_dbfs": -17.71,
        "peak_dbfs": -12.89,
        "snr_db": 38.28,
        "clipping_detected": false,
        "dc_offset": -1e-05
      },
      "review": {
        "status": "ACCEPTED",
        "reviewer_id": "REV_MUNDARI_01",
        "pronunciation_quality": "EXCELLENT_NATIVE",
        "timestamp_iso": "2026-09-04T10:12:30.865653+00:00",
        "notes": "MOCK_FIXTURE_FOR_PIPELINE_VALIDATION_ONLY"
      }
    },
    {
      "recording_id": "REC_MOCK_CHILD_GIRL_SPK_C01_NUM03_REP01",
      "file_path": "data/processed/mock_field_session/REC_MOCK_CHILD_GIRL_SPK_C01_NUM03_REP01.wav",
      "speaker_id": "SPK_C01",
      "speaker_group": "CHILD_GIRL",
      "class_index": 3,
      "label_id": "num_03",
      "domain": "FLN_GRADE1_NUMERACY",
      "prompt_type": "ISOLATED_WORD",
      "prompt_text": "आपिया",
      "transcribed_text": "आपिया",
      "phonetic_transcription": "apia",
      "dialect_region": "Naguri (Khunti District)",
      "repetition": 1,
      "session_num": 1,
      "audio_metrics": {
        "sample_rate_hz": 16000,
        "channels": 1,
        "bit_depth": 16,
        "duration_ms": 1000.0,
        "rms_dbfs": -17.71,
        "peak_dbfs": -12.93,
        "snr_db": 38.36,
        "clipping_detected": false,
        "dc_offset": 1e-05
      },
      "review": {
        "status": "ACCEPTED",
        "reviewer_id": "REV_MUNDARI_01",
        "pronunciation_quality": "EXCELLENT_NATIVE",
        "timestamp_iso": "2026-09-04T10:12:30.884023+00:00",
        "notes": "MOCK_FIXTURE_FOR_PIPELINE_VALIDATION_ONLY"
      }
    },
    {
      "recording_id": "REC_MOCK_CHILD_GIRL_SPK_C01_NUM03_REP02",
      "file_path": "data/processed/mock_field_session/REC_MOCK_CHILD_GIRL_SPK_C01_NUM03_REP02.wav",
      "speaker_id": "SPK_C01",
      "speaker_group": "CHILD_GIRL",
      "class_index": 3,
      "label_id": "num_03",
      "domain": "FLN_GRADE1_NUMERACY",
      "prompt_type": "ISOLATED_WORD",
      "prompt_text": "आपिया",
      "transcribed_text": "आपिया",
      "phonetic_transcription": "apia",
      "dialect_region": "Naguri (Khunti District)",
      "repetition": 2,
      "session_num": 1,
      "audio_metrics": {
        "sample_rate_hz": 16000,
        "channels": 1,
        "bit_depth": 16,
        "duration_ms": 1000.0,
        "rms_dbfs": -17.71,
        "peak_dbfs": -12.92,
        "snr_db": 38.35,
        "clipping_detected": false,
        "dc_offset": -3e-05
      },
      "review": {
        "status": "ACCEPTED",
        "reviewer_id": "REV_MUNDARI_01",
        "pronunciation_quality": "EXCELLENT_NATIVE",
        "timestamp_iso": "2026-09-04T10:12:30.900569+00:00",
        "notes": "MOCK_FIXTURE_FOR_PIPELINE_VALIDATION_ONLY"
      }
    },
    {
      "recording_id": "REC_MOCK_CHILD_GIRL_SPK_C01_NUM04_REP01",
      "file_path": "data/processed/mock_field_session/REC_MOCK_CHILD_GIRL_SPK_C01_NUM04_REP01.wav",
      "speaker_id": "SPK_C01",
      "speaker_group": "CHILD_GIRL",
      "class_index": 4,
      "label_id": "num_04",
      "domain": "FLN_GRADE1_NUMERACY",
      "prompt_type": "ISOLATED_WORD",
      "prompt_text": "उपुनिय़ा",
      "transcribed_text": "उपुनिय़ा",
      "phonetic_transcription": "upunia",